Date,Tweet
2014-04-19,"Banco De Chile (BCH) 76.87 BCH How Tax Reform Will Affect These 2 Stocks Louie Grint, The Motley Fool - Motle"
2014-05-20,BCH Banco de Chile -- Moody's assigns Aa3 to Banco de Chile's
2014-08-02,BCH June- Stock Dividends
2014-08-12,BCH June- Stock Dividends
2014-08-13,BCH: Middle class is key to any investment in Peru
2015-09-15,'JBEM' pick RXII upcoming catalyst:Read here:  KRG OVBC MFSF CRRC KRC BFAM JHX BCH
2015-10-25,Banco de Chile Sees Large Volume Increase BCH
2015-12-12,BCH -1.53% Stock Charts BCH Banco de Chile ADR (NYSE) Last Updated: 12/11/2015 21:23:44 BCH Stock Chart - 1 M
2015-12-31,BCH - TheStreet Lowers Banco de Chile  to Sell
2016-02-27,Capstone Asset Management Company Increases Stake in Banco de Chile BCH
2016-03-24,Down -0.24% . See how to  BCH with the highest rated   :
