Date,Tweet
2014-12-24,RT : Pre-Christmas Survey Shows Strength In Electronics Sales -  SHLD HD BBY
2015-01-04,"ELNK Recent News Updated Sunday, January 4, 2015 00:06:27 AM MYEC INTC XLK HD"
2015-01-08,Tons of all-time highs today. Mostly consumer stocks. Already wrote about STZ. But WMT TGT LOW HD M KR at records as well.
2015-01-09,SUBSCRIBE NOW : AAPL BABA FB TWTR UGAZ SPY SPX INDU NKE HD WMT JOB DRYS MCP FNMA GPRO AMBA
2015-01-09,S&amp;P500  Trend CI STZ BSX MAS URBN AET VMC PHM AVY JNPR SHW LH BCR COH LEN DHI PRGO HD @
2015-01-10,"HD Stock Forum Updated Saturday, January 10, 2015 11:11:19 AM FNMA GOLD AAPL TWTR"
2015-01-10,"RT : TVIX Short Sales Updated Thursday, January 1, 2015 4:59:22 PM MYEC VXX HD GPRO"
2015-01-10,Top Tweets Concerning HD (Home Depot Inc symbol HD) on 01/10/2015
2015-01-13,Our Penny Stock Picks Gained Over 968% In 5 Weeks! Get our next pick early:  HD HOT AMIGY
2015-01-22,"HD Investor Opinions Updated Thursday, January 22, 2015 12:03:26 PM EWZ QLTS NEM CTIX"
2015-01-23,HD received a new alert. Find out why at          423
2015-01-24,"IBB Stock Message Board Updated Saturday, January 24, 2015 08:59:25 AM HD ADXS DDD WEST"
2015-01-27,"IBM AAPL HD:

Apple Inc. (NASDAQ:AAPL) Trading Outlook:"
2015-01-28,chartguy89: Stock Charts: JCP Stock Chart JCP SQQQ HD PEP
2015-01-28,Depot : Major retailers' tax challenge in New Albany costs firm job   HD
2015-01-30,"Today's ALL TIME NEW HIGHS, Over 1.00, Closed Up on at least 1.1x  ADV(50) ►►►   
Incl: TSCO BA SWKS HD BUD etc"
2015-01-31,"FB Stock Price Updated Friday, January 30, 2015 8:07:41 PM NEM HD NKE TASR"
2015-02-03,finally MAS gaining traction.Taken a long time while proxy HD at ATH. of course it's now a Tepper name :]]
2015-02-04,"JNJ Stock Forum Updated Wednesday, February 4, 2015 01:11:20 AM ELTP LEXG TS HD"
2015-02-05,We Have A MASSIVE New Penny Stock Pick Coming In A Few Hours! See How To Get It Early:  HD HOT AMIGY
2015-02-05,"Credit Suisse's Top Picks For 2015: Mondelez International (MDLZ), Home ... HD"
2015-02-05,S&amp;P100  Trend DIS GM V F COST HD ALL DVN HON APA TGT AMZN OXY XOM LOW SBUX BA UTX  @
2015-02-06,HD made a doji yesterday and maybe another today.  Looking to sell 112/116 call spread.  Is HD headed 4 a short term reversal?
2015-02-06,S&amp;P100  Trend USB HAL CVX DVN GM LOW UTX HON DIS F DD HD V AMZN OXY COP MS RTN BA  @
2015-02-06,"Making new highs: HD, JACK, V, LOW, ABMD, BIIB"
2015-02-06,"UPRO Percent Change Updated Thursday, February 5, 2015 11:11:15 PM HD SCTY ITB TZA"
2015-02-07,NFLX Netflix Inc (NFLX) 444.36 -4.55 (-1.01%) HD JPM IEF
2015-02-07,"LPLA TGT HD ANTM ALL IT:

Data Breaches Spark Debates on CISO, CIO Dynamic:"
2015-02-09,Commented on StockTwits: 1044 viewed the original HD Lucky Ohio as amateurs figure the pictures don't have an eg...
2015-02-10,"HD a beast, thinking about rolling my Feb 108 Calls"
2015-02-10,"Home Depot to hire 80,000 workers for its spring selling season HD  via"
2015-02-11,TOP Discussed DJIA Companies  Available for Subcription at  KO HD
2015-02-12,"HD M JCP PETM:

Martha Stewart Living Omnimedia: Unfavorable Trends Make Her A ...:"
2015-02-13,"T/S :  Also, working on those companies reporting next 2-3 weeks (WMT, JWN, M, HD, LOW, TGT, CHS, KSS, ROST, GPS, BBY, ANF)."
2015-02-13,chartguy89: HD Stock Chart HD XLY NUGT VXX
2015-02-13,HNU.TO Stock Chart HNU.TO Most recent stock chart and technical analysis. VNQ MU IBM SMH HD SCTY
2015-02-15,"EXAS Stock Price Updated Sunday, February 15, 2015 01:03:12 AM GILD HD DAL WMIH"
2015-02-16,trying to build a hero trade with HD LOW as gotten myself off the high horse.protect profits at all times.
2015-02-21,"ECIG Company Info Updated Saturday, February 21, 2015 04:59:22 AM HD GS GREK MMM"
2015-02-21,"AMZN Stock Message Board Updated Saturday, February 21, 2015 07:03:22 AM WMT EWJ HD COHU"
2015-02-23,Our Penny Stock Picks Gained 342% In the Past 2 Weeks! Get Our New Pick Early:  HD HOT AMIGY
2015-02-23,I bought HD 112 n 113 Calls March 6. Crossing me fingers :-)
2015-02-24,"RT : Fourth Quarter 2014 U.S. Sales

 +1.3%
 +8.9% HD"
2015-02-24,"HD this year Home Depot's share buyback equates to almost 50,000 per employee"
2015-02-24,HD at this valuation is grossly out of whack. How can this even be on your radar? Are YOU backing ip the truck on thus one?
2015-02-24,HD added shorts 115.70s
2015-02-24,RT : Home Depot and J.P. Morgan top gainers as Dow explores all-time highs.  HD JPM
2015-02-24,"RT : Comp sales were positive 7.9%, U.S. stores had a positive comp of 8.9% HD"
2015-02-24,HD LOW Operating Margin Trends
2015-02-24,"HD 112.28 Home Depot Stock Charts HD Last Updated: 02/23/15 Last price: 112.28 Total volume: 5,637,972 HD Sto"
2015-02-24,RT : Wedbush Analyst: Home Depot Q4 At Risk From High Expectations HD
2015-02-24,"After America's  purely discretionary retailer reports 9% US comps, can we finally please stop saying how 'weak' US consumer is? HD"
2015-02-24,RT : Option volume leaders @ CBOE: AAPL RIG HPQ TSLA C KO HD TWTR BAC
2015-02-24,HD is a fader
2015-02-24,"RT : Home Depot and Lowe's shares are priced for near perfection,  of Estimize tells us.  HD …"
2015-02-24,Notable companies reporting before tomorrow's open; CMCSA HD AMT ECL M PLL WIN
2015-02-24,"RT : Fourth Quarter 2014 U.S. Sales

 +1.3%
 +8.9% HD"
2015-02-24,Home Depot profit beats estimates  HD LOW
2015-02-25,HD has 8 analyst ratings in the last 7 days and 87% are positive. Median target: 128
2015-02-25,Hottest Discussions in the Financial Market   HPQ HD  AV
2015-02-25,"RT : thanks, Dougie: credit HD/Tome!! :  Must Read! Brilliant piece by Jim on RealMoneyPro, ""The Boom Under t…"
2015-02-25,"TGT DLTR TJX LL SHOO M HD ROST SHLD KSS JCP GPS .SPX LB:

Don't sweat retail earnings, yet:"
2015-02-25,RT : We released our Q4 earnings this morning. See our :  HD
2015-02-26,RT : 3 Option Calls With UP To 200% Gain Potential : NKE HD CVS PLEASE Take a Look At How Much They Are Now :
2015-02-26,"HD Last Price Updated Thursday, February 26, 2015 01:06:55 AM VTI CHK BTU CRM"
2015-02-28,RT : TLT IBB GPRO MA Tuesday Morning Market Video – SPY HD GOOGL AAPL QQQ IWM HPQ SAM WBMD
2015-02-28,"Stocks Trending Now:  

KITE KR CLR XLI UVXY XPH HD FB RIGH CTSH FEYE BAA ~"
2015-03-01,"MU Recent News Updated Saturday, February 28, 2015 7:25:17 PM XLF USO VTI HD"
2015-03-03,"CMCSA HD TJX:

Company Cash Bathes Stocks as Monthly Buybacks Set Record:"
2015-03-04,Editor's Choice: Seeing Green In The Housing Market by  HD LOW TOL MTH TPC TPH WY ETH
2015-03-04,RT : There have been several noteworthy developments in the  space. WMT AMZN KSS OSTK RL CRI CHS HD LOW
2015-03-04,RT : Home Depot to invest 200 million in its Cobb County operations  HD
2015-03-04,"PBR Recent News Updated Wednesday, March 4, 2015 03:07:15 AM NUGT SLV SH HD"
2015-03-06,"SHORT HD 114.45, SELL HOG 62.06, SHORT IPE 55.87, SELL JNJ 100.11. More stock tips &amp; details at:"
2015-03-07,"RT : Stocks Trending Now:  

GG TBT JDST CTIC SLTD IBB UUP PCLN HD XOMA AAPL SVXY ~"
2015-03-07,"ADMD Percent Change Updated Saturday, March 7, 2015 00:03:46 AM HD NIOBF RUSL TZA"
2015-03-11,RT : Retail Results Lift Consumer Discretionary Earnings To 10.7%  HD LOW WMT TGT M JCP ANF AEO …
2015-03-13,"HD:

Deutsche Bank's 10 Takes After Meeting Home Depot Management:"
2015-03-13,HD EPS Accelerating Chart:
2015-03-14,"HD Reviews Updated Saturday, March 14, 2015 12:59:20 PM FB PSID CSCO INCC"
2015-03-14,"PVSP Stock Price Updated Saturday, March 14, 2015 4:11:27 PM SNDK HD UPRO HD"
2015-03-17,"TNA Short Sales Updated Tuesday, March 17, 2015 2:59:23 PM PCLN LNKD HD MU"
2015-03-17,"LOW, LL, TTS, SHOS, HD Earnings Trend Comparison"
2015-03-17,"MHYS Reviews Updated Monday, March 16, 2015 12:03:44 PM EA HD ACAD SLW"
2015-03-19,NEW SEC Filing for HD filed a moment ago:
2015-03-20,"SSO Stock Message Board Updated Thursday, March 19, 2015 10:11:23 PM HD TLT MCP PFE"
2015-03-20,We Have Major New Penny Stock Picks On the Way! Special Update:  HD HOT AMIGY
2015-03-21,"HD, LOW, LL, TTS, SHOS EPS Trend Comparison"
2015-03-22,"LOW, LL, TTS, SHOS, HD Earnings Trend Comparison"
2015-03-26,"HD ALERT: New The Home Depot, Inc. SEC Filing
From our Stock News Alerts App"
2015-03-26,Weekly Dow  Trend MCD MRK PFE NKE VZ UNH TRV CVX DIS HD IBM UTX BA KO XOM AAPL PG JNJ  @
2015-03-27,"LOW vs. BBY vs. HD vs. LB Compared Across 9 Critical Measures
Chart:"
2015-03-30,RT : Home Depot hires first chief information security officer   HD
2015-03-31,Why Is Home Depot Accelerating The Buyback Program?  HD
2015-03-31,"Home Depot: Fiscal 2014 Earnings Review, Tailwinds Galore  HD"
2015-04-01,RT : VLTC DVAX AGEN HD !!!
2015-04-04,"Largest Retailing Earnings
1. HD
2. LOW
3. PCLN
Full Chart:"
2015-04-05,"HD Percent Change Updated Sunday, April 5, 2015 03:59:20 AM JNJ PKG HD EWJ"
2015-04-07,...2 of 20 Trading Ranges / Channels - HD
2015-04-08,Dow  Trend CVX IBM MMM GS JPM KO PFE BA MSFT XOM AAPL MCD GE HD V UTX DD VZ JNJ CAT  @
2015-04-09,"HD vs. LOW vs. LB vs. SPLS Compared Across 9 Critical Measures
Chart:"
2015-04-14,HD HD Stock — 3 Reasons Why Home Depot&amp;;s Long-Term Outlook Is Bright
2015-04-14,"EEM Day High

Click Here: 

Also See: HD TAXI REPH CVX ~"
2015-04-15,"Free video w/setups April 15 ""Stock Pickers Market""  FB NFLX HD LOW STUDY"
2015-04-15,Platinum Members Saw Our Stock Alerts Gain Over 1600% In 4 Months! Subscribe Here:  HD HOT AMIGY
2015-04-16,"LOW vs. HD vs. TJX vs. SPLS Compared Across 9 Critical Measures
Chart:"
2015-04-17,"HD has been an ominous tell, it hasn't been able to jump for weeks even as we rallied."
2015-04-21,"CCC EOD Data

Click Here: 

Also See: SNBNP CHMT HD SXCP ~"
2015-04-28,Our Penny Stock Picks Gained 1472% In 2 Months! Get Access To Our New Pick:  HD HOT AMIGY
2015-04-28,"HD Lowe&amp;;s Companies, Inc. (LOW), Home Depot Inc (HD) Face Increasing Pressure ..."
2015-05-01,"HD Filings Updated Friday, May 1, 2015 11:59:21 AM LNKD NBIX XLF GG"
2015-05-01,"HD News: ""Has Home Depot Maxed Its Potential? HD""   Analyze:"
2015-05-04,"IWM Last Price Updated Monday, May 4, 2015 3:07:14 PM RIG EDC THCZ HD"
2015-05-04,"AGEN Opinions Updated Monday, May 4, 2015 04:59:22 AM JNK SLV HD MOO"
2015-05-07,"STOCKWATCH:  stocks showing early strength, HD, LOW, DKS, &amp; JWN are all trading nicely in the green."
2015-05-07,"ERY Direxion Daily Energy Bear 3x Shares Stock Forum
Click Here -&gt; 

Trending ERY AMZN AEM HD  …"
2015-05-08,Largest Retailing Capital Expenditures  VIPS  TGT  HD  JD  LB  PCLN  Chart:
2015-05-08,"UNG Stock Price Updated Thursday, May 7, 2015 9:07:21 PM UNG HD DIA XLB"
2015-05-09,"SH ProShares Short S&amp;P 500 Fund 52Wk Low
Click Here -&gt; 

Trending SH NUGT HD MRU.TO"
2015-05-11,"One of several highlights fm Plug Power Q1 call - major new customer, Home Depot. PLUG HD."
2015-05-11,"HD Home Depot, Inc. % Change
Click Here -&gt; 

Trending HD EA EWO OPXA"
2015-05-13,"WMT Wal-Mart Stores, Inc. % Change
Click Here -&gt; 

Trending WMT DIS HD WMT"
2015-05-14,HD vs. LB vs. TJX vs. BBY Compared Across 9 Critical Measures
2015-05-15,Largest Retailing Earnings  VIPS  HD   JD  LB  PCLN  Chart:
2015-05-16,"OLED Universal Display Corp. 52Wk High
Click Here -&gt; 

Trending OLED XOP HD QID"
2015-05-17,"HD Home Depot, Inc. Quotes
Click Here -&gt; 

Trending HD FV UNH RFMK"
2015-05-17,"VTI Vanguard Total Stock Market ETF Filings
Click Here -&gt; 

Trending VTI PBR IBM HD"
2015-05-17,"HD Home Depot, Inc. E.P.S.
Click Here -&gt; 

Trending HD THCZ SWKS GS"
2015-05-17,"HD Home Depot, Inc. E.P.S.
Click Here -&gt; 

Trending HD CBYL CGRA SYN"
2015-05-17,"HD Home Depot, Inc. Stock Message Board
Click Here -&gt; 

Trending HD CU DAL HYT"
2015-05-17,Earnings Week of 5/18 – 5/22  HD and WMT kick things off Tuesday before the open
2015-05-17,RT : How a mustache cost Ross Perot 100 billion. HD
2015-05-17,"ChartSmarter Monday Game Plan:  ""retail in focus this week"" PRTY TCS WSM GPS AEO TJX HD"
2015-05-18,Earnings Week of 5/18 – 5/22  WMT HD reporting tomorrow before the open
2015-05-18,"EA Endexx Corp. Investor Opinions
Click Here -&gt; 

Trending EA QLGC HD AAPL"
2015-05-18,"BBY HD TGT News: ""Big-Box Retailers Step Into The Spotlight For Earnings This…""   Analyze:"
2015-05-18,"nasdaqfan: XOM Exxon Mobil Corp. News
Click Here -&gt; 

Trending XOM TNA JNK HD  …"
2015-05-18,"WMT TGT HD News: ""Watching  and  today? Find out what…""   Analyze:"
2015-05-18,RT : NEW POST: Stock Market Recap 05/18/15 {Video}  AAPL DDD HD NFLX SPY
2015-05-18,RT : URBN WMT HD LOW TGT CRM
2015-05-19,HD received a new alert. Find out why at          620
2015-05-20,"HD Home Depot, Inc. Current Price
Click Here -&gt; 

Trending HD WFC CLDN AMZN"
2015-05-20,"LOW HD:

Lowe's Earnings Bring Fears of a Housing Slowdown:"
2015-05-21,Home Depot Upgrade by Vetr Research (Ranked 90th) to Sell with 108.17 PT HD   Research
2015-05-21,"HD Home Depot, Inc. 52Wk Low
Click Here -&gt; 

Trending HD PCY KGC BND"
2015-05-22,"FEYE FireEye Inc. EOD Data
Click Here -&gt; 

Trending FEYE HD SMN ZNGA"
2015-05-22,"HD Home Depot, Inc. Ideas
Click Here -&gt; 

Trending HD GRUB GDP SCTY"
2015-05-23,"ESRX Express Scripts, Inc. Quotes


ESRX ESRX MBLY HD"
2015-05-23,"HD Home Depot, Inc. Ask


HD GM RAI GE"
2015-05-23,Home Depot’s Neutral Rating Reiterated at Wedbush HD
2015-05-25,"XAU.V iShares CDN S&amp;P/TSX Capped Information Technology Index Fund Prev Close


XAU.V PSI.TO AMBA HD .V…"
2015-05-25,Largest Retailing Cash from Operations vs. Valuation  HD  PCLN   JD  LB   Chart:
2015-05-26,"BAC Bank Of America Corp. EOD Data


BAC XLI GDXJ HD"
2015-05-27,"YOKU Youku Tudou, Inc. Last Trade


YOKU CLF SHAK HD"
2015-05-27,"HD Home Depot, Inc. Ask Size


HD MCP XOM XOM"
2015-05-27,"GILD Gilead Sciences, Inc. Financials


GILD CNC IWM HD"
2015-05-28,"HD active, relative volume: 10.4, 1H, 7:00 PM,  DJI SPY"
2015-05-28,HD: Analyst action by JP Morgan on Home Depot:
2015-05-28,"HACK PureFunds ISE Cyber Security ETF % Change


HACK AIRM DAL HD"
2015-05-29,"HZNP Horizon Pharma plc Exchange


HZNP HD AMRN TASR"
2015-05-29,"MDCN Medican Enterprises, Inc. Prev Close


MDCN HD XLV DIA"
2015-05-31,"HD Home Depot, Inc. Ask Size


HD FV WFC CAT"
2015-06-01,"HD Home Depot, Inc. Open


HD PCLN ZIOP NBIX"
2015-06-01,"RT : RT RT RT HD Home Depot, Inc. Prev Close


HD BIDU TWTR IWM    … …"
2015-06-01,LOW vs. HD vs. TJX vs. SPLS Compared Across 9 Critical Measures
2015-06-01,"TQQQ ProShares UltraPro QQQ % Change


TQQQ ATVI DUST HD"
2015-06-03,"XLI Industrials Select Sector SPDR Prev Close


XLI AXN CPB HD"
2015-06-08,"AXN Aoxing Pharmaceutical Co. Inc. Volume


AXN HD SWKS AXN"
2015-06-09,RT : Dow Stocks Oversold And Breaking Down  AAPL  AXP BA CAT CSCO CVX DD DIS GE GS HD …
2015-06-10,"HD:

Shares of Home Depot, Inc. (The) (NYSE:HD) Sees Large Inflow of ...:"
2015-06-10,"KMI Kinder Morgan Inc. Volume


KMI NQ HD C"
2015-06-10,"SMH Market Vectors Semiconductor Investor Opinions


SMH HD UA XLU"
2015-06-11,"HEU.TO Horizons BetaPro S&amp;P/TSX Global Gold Bear Plus ETF Ideas


HEU.TO FDN TVIX HD .TO"
2015-06-11,"HD Home Depot, Inc. Bid


HD FDX BABA MCK"
2015-06-12,"TASR TASER Intl Inc. Tick


TASR BABA AUY HD"
2015-06-12,"NUGT Direxion Daily Gold Miners Bull 3x Shares Filings


NUGT HD AXP TRQ"
2015-06-15,"HD Home Depot, Inc. Summary


HD CCTL HNR EWG"
2015-06-16,Website -&gt;  HD Revenue is Growing.
2015-06-16,Our Stock Pick On PPCH Has Gained Over 122% In The Past 2 Weeks! Major News:  HD HOT AMIGY
2015-06-17,"WMT Wal-Mart Stores, Inc. Yield


WMT HD INSY RCPT"
2015-06-17,"JO iPath Bloomberg Coffee Subindex Total Return ETN News


JO HD SMH XLV"
2015-06-18,"UGAZ VelocityShares 3x Long Natural Gas ETN Stock Forum


UGAZ MJMJ KO HD"
2015-06-18,"GLD SPDR Gold Trust Shares EOD Data


GLD AKAM NFLX HD"
2015-06-18,"HOU.TO Horizons BetaPro NYMEX Crude Oil Bull Plus ETF EOD Data


HOU.TO AEM XLK HD .TO …"
2015-06-19,"HD Home Depot, Inc. 52Wk High


HD RAD MMSI ESNT"
2015-06-19,"HD Home Depot, Inc. Quotes


HD GILD FEYE RAD"
2015-06-19,"GD News Updated Friday, June 19, 2015 11:07:21 AM HZNP EA HD AA"
2015-06-20,"HD WisdomTree Europe Hedged Equity ETF EOD Data


HD DATA IYR CNX"
2015-06-21,Every Financial And Fundamental Metric Has Been Increasing At Home Depot Except The Price  HD
2015-06-21,"VRX Valeant Pharmaceuticals Intl, Inc. Tick


VRX HD XLU THCZ"
2015-06-21,"ABC AmerisourceBergen Corp. Dividend


ABC GLD AMED HD"
2015-06-24,RT :  6/24: DFRG ECR VNDA CTL SN MBI GRFS MA HD AGCO LL JUNO DKS ABC ON FEYE X
2015-06-25,"WPWR Well Power, Inc. Ideas


WPWR NKE HD TZA"
2015-06-25,"UNG United States Natural Gas Fund Prev Close


UNG XLB HD PMCB    bo…"
2015-06-28,"HD Home Depot, Inc. EOD Data


HD AMBA MO TPAC"
2015-06-29,"RT : ZIOP ZIOPHARM Oncology, Inc. Open


ZIOP HD VZ NBG"
2015-06-29,"RT : Notable opening imbalances: BAC -1.1M, C -184K, BABA -234K, TWTR -222K, GE -147K, F -108K, V -52K, HD -48K, T -…"
2015-06-30,"QCOM QUALCOMM Inc. Message Board Posts


QCOM CVC HD XLP"
2015-06-30,"SMH Market Vectors Semiconductor Investor Opinions


SMH HD TRQ SCO"
2015-07-01,"Lowes and Home Depot May Fool Bulls, but Here's the Real 'Low'down HD"
2015-07-01,"RT : Lowes and Home Depot May Fool Bulls, but Here's the Real 'Low'down HD"
2015-07-01,"HD AdvisorShares Active Bear ETF Dividend


HD GT CEMP BIIB"
2015-07-01,"HD Home Depot, Inc. Investor Opinions


HD IHS MJMJ C"
2015-07-03,"EWY South Korea iShares Day Low


EWY CNET HD MJMD"
2015-07-04,"MO Altria Group Inc. Filings


MO HD IHF SJ.TO"
2015-07-04,"HD Home Depot, Inc. Market Cap


HD PEP ONCI AAPL"
2015-07-05,Interactive Chart -&gt;  HD Revenue and Earnings are Rising.
2015-07-05,"ACUR Acura Pharmaceuticals, Inc. Yield


ACUR CI FEYE HD    …"
2015-07-07,"ABBV AbbVie Inc. Company Info


ABBV FXE CAT HD"
2015-07-10,"HD Home Depot, Inc. Quotes


HD BBRY TASR FEYE"
2015-07-10,"JNJ Johnson &amp; Johnson Day Low


JNJ ONE SCTY HD"
2015-07-11,"SBIO ALPS Medical Breakthroughs ETF Market Cap


SBIO SWKS TWX HD"
2015-07-11,"HD Home Depot, Inc. Company Info


HD SCHW FDN XLY    WisdomTree Europe Hedged…"
2015-07-11,"MANH Manhattan Associates, Inc. Last Trade


MANH HD VLTC TZA"
2015-07-11,"MBFI MB Financial, Inc. Stock Forum


MBFI JNJ HD XLV"
2015-07-11,"MYEC MyECheck, Inc. Last Trade


MYEC DAL HD ABBV"
2015-07-11,"JNK SPDR Barclays High Yield Bond ETF Last Trade


JNK JCE HD PEIX"
2015-07-11,"CI CIGNA Corp. Ideas


CI PCG HD IBB"
2015-07-11,Our Platinum Subscribers Saw Their Penny Stock Alerts Gain Over 350% In 2 Weeks! Big Update:  HD HOT AMIGY
2015-07-12,"FITX Creative Edge Nutrition, Inc. Last Price


FITX GDX HD AHS    Flamel…"
2015-07-12,"TOP NYSE DROPS IN SHORTS:
BAC RAD LLY NBG ABBV HLT WMB KMI KO PHH SPF HD BSX MDLZ PFE CVC RAI"
2015-07-12,"SGYP Percent Change Updated Sunday, July 12, 2015 01:10:53 AM HZNP SUPN UUP HD"
2015-07-14,"Copycat play sold to open HD 117/119 August 28 call vertical, for .73"
2015-07-15,"HD Home Depot, Inc. Exchange


HD X GDX TQQQ"
2015-07-15,"SGY.TO Surge Energy Inc. Stock Message Board


SGY.TO C UCO HD .TO"
2015-07-15,"HD Home Depot, Inc. News


HD CAT HCLP JDST"
2015-07-15,"UPRO ProShares UltraPro S&amp;P 500 52Wk Low


UPRO HD UVXY RGSE   …"
2015-07-16,"VLTC Valeant Pharmaceuticals Intl, Inc. E.P.S.


VLTC JNK WMT HD"
2015-07-16,"CCT.L Character Group Shares


CCT.L UNG HD NFLX .L"
2015-07-17,HD Home Depot builds momentum:
2015-07-18,Our Stock Pick On PPCH Is Up Over 300% Since Our Original Release At .02! Huge News:  HD HOT AMIGY
2015-07-18,Our Platinum Subscribers Saw Their Penny Stock Alerts Gain Over 350% In 2 Weeks! Big Update:  HD HOT AMIGY
2015-07-19,"HD - SELL Signal at 114.47 on Jul 17, 15 By YaMasuta, FREE Algorithmic Trading Software"
2015-07-20,"HD Home Depot, Inc. Last Price


HD AAPL GTN GG"
2015-07-21,Our Platinum Subscribers Saw Their Penny Stock Alerts Gain Over 350% In 2 Weeks! Big Update:  HD HOT AMIGY
2015-07-22,"Home improvement stocks rally after Owens Corning results, home sales data OC MHK LOW HD MAS BECN VAL ..."
2015-07-22,"JNK SPDR Barclays High Yield Bond ETF Ask Size


JNK VLTC HD VALE"
2015-07-23,"ARNA Arena Pharmaceuticals Bid


ARNA XLE TLT HD"
2015-07-23,"STRP Straight Path Communications Inc. Dividend


STRP WMT TBT HD"
2015-07-23,"DXJ iShares MSCI Emerging Markets News


DXJ NUGT HD MDXG"
2015-07-24,"TCK iShares Barclays TIPS Bond Fund Chart


TCK GPRO XHB HD"
2015-07-24,"[TOP 5] 
*Since Jan 13, 1978

HD 327,658.62%
WMT 91,626.34%
UNH 81,781.05%
CSCO 74,047,29%
MSFT 45,544%

;-)"
2015-07-25,"VTI Vanguard Total Stock Market ETF Chart


VTI AAPL BRFS HD"
2015-07-25,"LAYN Layne Christensen Co. Prev Close


LAYN F FB HD"
2015-07-26,Interactive Chart -&gt;      HD Return on Equity is Rising.
2015-07-27,HD closed my puts. Had to protect profits
2015-07-30,"HD Home Depot, Inc. Dividend


HD MNKD CBAI BND"
2015-07-30,"SMH Market Vectors Semiconductor Yield


SMH SHOP EXAS HD"
2015-07-31,"HD Home Depot, Inc. 52Wk Low


HD NKE XOM COP"
2015-07-31,"JDST Direxion Daily Junior Gold Miners Index Bear 3X Shares EOD Data


JDST HD AMBA UUP  …"
2015-07-31,"HD Home Depot, Inc. Filings


HD CHK DATA AXP"
2015-08-01,"LNKD LinkedIn Corp. Quotes


LNKD ATST.L USO HD"
2015-08-02,"HD Home Depot, Inc. Stock Message Board


HD IWM ACAD CERN"
2015-08-02,"HD Home Depot, Inc. 52Wk High


HD GLD XLY TCK/B.TO"
2015-08-02,"RT : T ProShares UltraShort  20+ Year Treasury Exchange


T HD DBA CROX"
2015-08-02,"C Last Price Updated Saturday, August 1, 2015 11:59:20 PM KBE WMB DBA HD"
2015-08-02,"Our Penny Stock Picks Have Gained 3,600% In 10 Months! Get Early Access To Our Next Pick:  HD HOT AMIGY"
2015-08-02,"INCY Incyte Corp. Ask Size


INCY XLP HD INCY"
2015-08-03,"RT : Holding All Positions Here : NKE BIDU FB HD DIS WMT EBAY SBUX Calls , BIDU Strangle ..."
2015-08-03,"BRWC Boreal Water Collection Inc. Current Price


BRWC HD BABA DXJ"
2015-08-03,"HD Home Depot, Inc. Tick


HD TSLA CELG XLE"
2015-08-06,"RYAAY Sabre Corp. Bid Size


RYAAY SDRL HD NAT"
2015-08-07,"AA Alcoa, Inc. Message Board Posts


AA DNRG HD ARWR"
2015-08-07,"AMZN  Inc. Company Info


AMZN GG GE HD"
2015-08-07,"MUX McEwen Mining Inc. Summary


MUX HD GLD RAD    MyECheck, Inc. Exchange…"
2015-08-10,"HD: 3 open, suited signals indicate continued price increase beyond average holding times."
2015-08-14,"FEYE FireEye Inc. News


FEYE CMG HD FCX    Fitbit, Inc. Ask…"
2015-08-17,RT : Notable companies reporting before tomorrow's open WMT HD TJX HAIN DKS TSL: Full Story
2015-08-17,RT : Notable companies reporting before tomorrow's open WMT HD TJX HAIN DKS TSL: Full Story
2015-08-18,"WMT misses expectations, lowers guidance; HD reports today. Have a great day folks!"
2015-08-18,RT : Both our Mexican and Canadian businesses posted positive comps in the quarter. HD
2015-08-18,"Home improvement stocks, Fed top trades to go     HD LOW"
2015-08-18,RT : Home Depot had planned 4.5bn of share buybacks this year. HD has just upped that to 7bn! Cash flow management stellar
2015-08-18,Both our Mexican and Canadian businesses posted positive comps in the quarter. HD
2015-08-18,RT : We had a record number of transactions in Q2 and highest quarterly average ticket since 2006. HD
2015-08-18,RT : For additional information and transcript from today’s earnings call visit:  HD
2015-08-18,We already booked 6 double digit winners this month SPX TSLA HD BABA PCLN RL  Join us and learn options trading
2015-08-19,Home Depot's outperform rating reiterated at Credit Suisse. 120.00 PT.  HD
2015-08-19,Weekly Dow  Trend HD MCD TRV MSFT UNH AXP NKE MRK BA JPM KO CAT V PFE VZ JNJ GE DD UTX @
2015-08-19,We've got HD trending up with 86% confidence:
2015-08-20,Morgan Stanley Reiterates “Equal Weight” Rating for Home Depot HD
2015-08-20,Recent housing starts news really moving HD LOW-  I like HD better technically.  SPY SPX QQQ
2015-08-20,"HD Top news - Aug 20th, 2015 HD"
2015-08-21,Weekly S&amp;P100  Performance LLY EXC LOW TGT HD SPG BMY SO T MCD JNJ V LMT UNH EMR GM more@
2015-08-21,RT : DIA has always been the weakest index not the best indicator of the overall market. in a true bear market HD could not …
2015-08-21,"Ok Team, looking into another +45 day play on HD. The evening star pattern has emerged."
2015-08-24,HD 92.17.
2015-08-24,no that account is for strong stocks not knife catching.. add to HD only thing im looking at.
2015-08-24,Lg-Cap Portfolio only holding HD currently with stops at 112. Will do a special post soon. Exits triggered SBUX FB UNH
2015-08-25,"SPDR® Dow Jones Industrial Average ETF DIA -8.6% year to date return, top ten holdings GS IBM MMM BA UNH AAPL DIS HD NKE TRV"
2015-08-25,HD: Analyst action by Jefferies on Home Depot:
2015-08-25,"HD Home Depot, Inc. Prev Close


HD FIT SBUX AGN"
2015-08-25,"RT : HD Home Depot, Inc. Company Info


HD XBI RAI SOXL"
2015-08-25,"HD ALERT: New The Home Depot, Inc. SEC Filing
From our Stock News Alerts App"
2015-08-25,Home Depot (HD) Showing Signs Of Being Water-Logged And Getting Wetter HD
2015-08-25,HD: Analyst action by Barclays on Home Depot:
2015-08-25,"HD Horizons BetaPro S&amp;P/TSX Global Gold Bull Plus ETF Last Trade


HD SH BRK/B TQQQ"
2015-08-26,"HD Home Depot, Inc. Last Price


HD AMGN P XLI"
2015-08-26,"FCX Freeport-McMoRan, Inc. Market Cap


FCX AXP HD EWZ    FireEye Inc. Current Price…"
2015-08-26,"SSO.TO SunEdison, Inc. 52Wk High


SSO.TO C XLV HD .TO"
2015-08-26,HD: Analyst action by Citigroup on Home Depot:
2015-08-27,"Thinking about HD, looks like housing is getting steam."
2015-08-27,"SLV iShares Silver Trust Investor Opinions


SLV HD CRGP SMH"
2015-08-27,"AXP American Express Co. Change


AXP EXPE TBEV HD"
2015-08-27,"HD Home Depot, Inc. Ask Size


HD BLTA GPRO SGY.TO"
2015-08-27,"ITW Illinois Tool Works, Inc. P/E Ratio


ITW HD SMN AMZN"
2015-08-27,"HD Home Depot, Inc. Change


HD KSU LNKD CBM   .TO Horizons BetaPro S&amp;P/TSX Global…"
2015-08-28,"UBT Ulta Salon Cosmetics &amp; Fragrance Inc. Company Info


UBT WFC WING HD"
2015-08-28,"VXX Verizon Communications 52Wk High


VXX EUM GOLD HD"
2015-08-28,"AGN Allergan plc Bid Size


AGN EEM HD PANW"
